{
  "schema_version": 1,
  "profile_version": "1.0.0",
  "id": "behringer.x-touch-compact.layer-a",
  "manufacturer": "Behringer",
  "model": "X-Touch Compact — Standard Layer A",
  "midi_identity": {
    "input_name_patterns": ["X-TOUCH COMPACT"],
    "output_name_patterns": ["X-TOUCH COMPACT"]
  },
  "bank_size": 25,
  "bank_count": 1,
  "page_count": 1,
  "status": "community",
  "capabilities": ["commands", "push", "touch", "led", "values", "motorized"],
  "controls": [
    {"id": "encoder_01", "kind": "absolute_encoder", "input": {"message": "cc", "channel": 1, "number": 10}, "push": {"message": "note", "channel": 1, "number": 0}, "feedback": {"value": {"message": "cc", "channel": 1, "number": 10}, "led": {"message": "note", "channel": 1, "number": 0}}},
    {"id": "encoder_02", "kind": "absolute_encoder", "input": {"message": "cc", "channel": 1, "number": 11}, "push": {"message": "note", "channel": 1, "number": 1}, "feedback": {"value": {"message": "cc", "channel": 1, "number": 11}, "led": {"message": "note", "channel": 1, "number": 1}}},
    {"id": "encoder_03", "kind": "absolute_encoder", "input": {"message": "cc", "channel": 1, "number": 12}, "push": {"message": "note", "channel": 1, "number": 2}, "feedback": {"value": {"message": "cc", "channel": 1, "number": 12}, "led": {"message": "note", "channel": 1, "number": 2}}},
    {"id": "encoder_04", "kind": "absolute_encoder", "input": {"message": "cc", "channel": 1, "number": 13}, "push": {"message": "note", "channel": 1, "number": 3}, "feedback": {"value": {"message": "cc", "channel": 1, "number": 13}, "led": {"message": "note", "channel": 1, "number": 3}}},
    {"id": "encoder_05", "kind": "absolute_encoder", "input": {"message": "cc", "channel": 1, "number": 14}, "push": {"message": "note", "channel": 1, "number": 4}, "feedback": {"value": {"message": "cc", "channel": 1, "number": 14}, "led": {"message": "note", "channel": 1, "number": 4}}},
    {"id": "encoder_06", "kind": "absolute_encoder", "input": {"message": "cc", "channel": 1, "number": 15}, "push": {"message": "note", "channel": 1, "number": 5}, "feedback": {"value": {"message": "cc", "channel": 1, "number": 15}, "led": {"message": "note", "channel": 1, "number": 5}}},
    {"id": "encoder_07", "kind": "absolute_encoder", "input": {"message": "cc", "channel": 1, "number": 16}, "push": {"message": "note", "channel": 1, "number": 6}, "feedback": {"value": {"message": "cc", "channel": 1, "number": 16}, "led": {"message": "note", "channel": 1, "number": 6}}},
    {"id": "encoder_08", "kind": "absolute_encoder", "input": {"message": "cc", "channel": 1, "number": 17}, "push": {"message": "note", "channel": 1, "number": 7}, "feedback": {"value": {"message": "cc", "channel": 1, "number": 17}, "led": {"message": "note", "channel": 1, "number": 7}}},
    {"id": "encoder_09", "kind": "absolute_encoder", "input": {"message": "cc", "channel": 1, "number": 18}, "push": {"message": "note", "channel": 1, "number": 8}, "feedback": {"value": {"message": "cc", "channel": 1, "number": 18}, "led": {"message": "note", "channel": 1, "number": 8}}},
    {"id": "encoder_10", "kind": "absolute_encoder", "input": {"message": "cc", "channel": 1, "number": 19}, "push": {"message": "note", "channel": 1, "number": 9}, "feedback": {"value": {"message": "cc", "channel": 1, "number": 19}, "led": {"message": "note", "channel": 1, "number": 9}}},
    {"id": "encoder_11", "kind": "absolute_encoder", "input": {"message": "cc", "channel": 1, "number": 20}, "push": {"message": "note", "channel": 1, "number": 10}, "feedback": {"value": {"message": "cc", "channel": 1, "number": 20}, "led": {"message": "note", "channel": 1, "number": 10}}},
    {"id": "encoder_12", "kind": "absolute_encoder", "input": {"message": "cc", "channel": 1, "number": 21}, "push": {"message": "note", "channel": 1, "number": 11}, "feedback": {"value": {"message": "cc", "channel": 1, "number": 21}, "led": {"message": "note", "channel": 1, "number": 11}}},
    {"id": "encoder_13", "kind": "absolute_encoder", "input": {"message": "cc", "channel": 1, "number": 22}, "push": {"message": "note", "channel": 1, "number": 12}, "feedback": {"value": {"message": "cc", "channel": 1, "number": 22}, "led": {"message": "note", "channel": 1, "number": 12}}},
    {"id": "encoder_14", "kind": "absolute_encoder", "input": {"message": "cc", "channel": 1, "number": 23}, "push": {"message": "note", "channel": 1, "number": 13}, "feedback": {"value": {"message": "cc", "channel": 1, "number": 23}, "led": {"message": "note", "channel": 1, "number": 13}}},
    {"id": "encoder_15", "kind": "absolute_encoder", "input": {"message": "cc", "channel": 1, "number": 24}, "push": {"message": "note", "channel": 1, "number": 14}, "feedback": {"value": {"message": "cc", "channel": 1, "number": 24}, "led": {"message": "note", "channel": 1, "number": 14}}},
    {"id": "encoder_16", "kind": "absolute_encoder", "input": {"message": "cc", "channel": 1, "number": 25}, "push": {"message": "note", "channel": 1, "number": 15}, "feedback": {"value": {"message": "cc", "channel": 1, "number": 25}, "led": {"message": "note", "channel": 1, "number": 15}}},
    {"id": "fader_01", "kind": "fader", "input": {"message": "cc", "channel": 1, "number": 1}, "touch": {"message": "cc", "channel": 1, "number": 101}, "feedback": {"value": {"message": "cc", "channel": 1, "number": 1}}},
    {"id": "fader_02", "kind": "fader", "input": {"message": "cc", "channel": 1, "number": 2}, "touch": {"message": "cc", "channel": 1, "number": 102}, "feedback": {"value": {"message": "cc", "channel": 1, "number": 2}}},
    {"id": "fader_03", "kind": "fader", "input": {"message": "cc", "channel": 1, "number": 3}, "touch": {"message": "cc", "channel": 1, "number": 103}, "feedback": {"value": {"message": "cc", "channel": 1, "number": 3}}},
    {"id": "fader_04", "kind": "fader", "input": {"message": "cc", "channel": 1, "number": 4}, "touch": {"message": "cc", "channel": 1, "number": 104}, "feedback": {"value": {"message": "cc", "channel": 1, "number": 4}}},
    {"id": "fader_05", "kind": "fader", "input": {"message": "cc", "channel": 1, "number": 5}, "touch": {"message": "cc", "channel": 1, "number": 105}, "feedback": {"value": {"message": "cc", "channel": 1, "number": 5}}},
    {"id": "fader_06", "kind": "fader", "input": {"message": "cc", "channel": 1, "number": 6}, "touch": {"message": "cc", "channel": 1, "number": 106}, "feedback": {"value": {"message": "cc", "channel": 1, "number": 6}}},
    {"id": "fader_07", "kind": "fader", "input": {"message": "cc", "channel": 1, "number": 7}, "touch": {"message": "cc", "channel": 1, "number": 107}, "feedback": {"value": {"message": "cc", "channel": 1, "number": 7}}},
    {"id": "fader_08", "kind": "fader", "input": {"message": "cc", "channel": 1, "number": 8}, "touch": {"message": "cc", "channel": 1, "number": 108}, "feedback": {"value": {"message": "cc", "channel": 1, "number": 8}}},
    {"id": "fader_master", "kind": "fader", "input": {"message": "cc", "channel": 1, "number": 9}, "touch": {"message": "cc", "channel": 1, "number": 109}, "feedback": {"value": {"message": "cc", "channel": 1, "number": 9}}, "roles": ["output"]}
  ]
}
