{
  "schema_version": 1,
  "profile_version": "1.0.0",
  "id": "akai.mpk-mini-mk3.program-1",
  "manufacturer": "Akai Professional",
  "model": "MPK Mini MK3 — Program 1",
  "midi_identity": {
    "input_name_patterns": [
      "MPK mini 3",
      "MPK mini mk3"
    ],
    "output_name_patterns": [
      "MPK mini 3",
      "MPK mini mk3"
    ]
  },
  "bank_size": 16,
  "page_count": 1,
  "status": "community",
  "capabilities": [
    "commands",
    "banks"
  ],
  "controls": [
    {
      "id": "encoder_01",
      "kind": "absolute_encoder",
      "input": {
        "message": "cc",
        "channel": 1,
        "number": 70
      }
    },
    {
      "id": "encoder_02",
      "kind": "absolute_encoder",
      "input": {
        "message": "cc",
        "channel": 1,
        "number": 71
      }
    },
    {
      "id": "encoder_03",
      "kind": "absolute_encoder",
      "input": {
        "message": "cc",
        "channel": 1,
        "number": 72
      }
    },
    {
      "id": "encoder_04",
      "kind": "absolute_encoder",
      "input": {
        "message": "cc",
        "channel": 1,
        "number": 73
      }
    },
    {
      "id": "encoder_05",
      "kind": "absolute_encoder",
      "input": {
        "message": "cc",
        "channel": 1,
        "number": 74
      }
    },
    {
      "id": "encoder_06",
      "kind": "absolute_encoder",
      "input": {
        "message": "cc",
        "channel": 1,
        "number": 75
      }
    },
    {
      "id": "encoder_07",
      "kind": "absolute_encoder",
      "input": {
        "message": "cc",
        "channel": 1,
        "number": 76
      }
    },
    {
      "id": "encoder_08",
      "kind": "absolute_encoder",
      "input": {
        "message": "cc",
        "channel": 1,
        "number": 77
      }
    },
    {
      "id": "pad_01",
      "kind": "pad",
      "input": {
        "message": "note",
        "channel": 10,
        "number": 36
      }
    },
    {
      "id": "pad_02",
      "kind": "pad",
      "input": {
        "message": "note",
        "channel": 10,
        "number": 37
      }
    },
    {
      "id": "pad_03",
      "kind": "pad",
      "input": {
        "message": "note",
        "channel": 10,
        "number": 38
      }
    },
    {
      "id": "pad_04",
      "kind": "pad",
      "input": {
        "message": "note",
        "channel": 10,
        "number": 39
      }
    },
    {
      "id": "pad_05",
      "kind": "pad",
      "input": {
        "message": "note",
        "channel": 10,
        "number": 40
      }
    },
    {
      "id": "pad_06",
      "kind": "pad",
      "input": {
        "message": "note",
        "channel": 10,
        "number": 41
      }
    },
    {
      "id": "pad_07",
      "kind": "pad",
      "input": {
        "message": "note",
        "channel": 10,
        "number": 42
      }
    },
    {
      "id": "pad_08",
      "kind": "pad",
      "input": {
        "message": "note",
        "channel": 10,
        "number": 43
      }
    }
  ]
}
